{
  "schema_version": 3,
  "artifact": "change-status",
  "change": "2026-08-10-fix-toolbox-command-context-and-blame-layout",
  "change_status": "active",
  "current_work": "specdev/implement",
  "created_at": "2026-08-10T08:50:28+08:00",
  "updated_at": "2026-08-11T16:49:15+08:00",
  "completed_at": null,
  "archived": false,
  "archive_path": null,
  "blockers": [
    "B-T01-002: 当前工具环境没有可控制 VS Code UI 的 computer-use/node_repl，AC-004/AC-005 真实主题截图未执行。"
  ],
  "deviations": [
    "D-T01-001: 用户禁止创建提交，固定点审查改用 HEAD 工作树 diff 与未跟踪清单。",
    "D-T01-002: 用户批准将已发布 v0.1.3 的 Blame 视觉修复前向递增至 v0.1.4，并更新日期/单附件布局契约。"
  ],
  "worktrees": []
}
