{
  "schema_version": 3,
  "artifact": "change-status",
  "change": "2026-08-10-copy-ranges-and-aggregate-git-review",
  "change_status": "completed",
  "current_work": null,
  "created_at": "2026-08-10T10:45:13+08:00",
  "updated_at": "2026-08-11T15:03:52+08:00",
  "completed_at": "2026-08-11T15:03:52+08:00",
  "archived": false,
  "archive_path": null,
  "blockers": [],
  "deviations": [],
  "worktrees": []
}
