{
  "schema_version": 3,
  "artifact": "change-status",
  "change": "2026-08-24-git-navigation-and-native-review",
  "change_status": "completed",
  "current_work": null,
  "created_at": "2026-08-24T14:35:54+08:00",
  "updated_at": "2026-08-24T15:45:56+08:00",
  "completed_at": "2026-08-24T15:45:56+08:00",
  "archived": false,
  "archive_path": null,
  "blockers": [],
  "deviations": [],
  "worktrees": []
}
