{
  "schema_version": 3,
  "artifact": "change-status",
  "change": "2026-08-12-git-blame-v2-reader",
  "change_status": "completed",
  "current_work": null,
  "created_at": "2026-08-12T15:35:31+08:00",
  "updated_at": "2026-08-12T20:07:30+08:00",
  "completed_at": "2026-08-12T20:07:30+08:00",
  "archived": false,
  "archive_path": null,
  "blockers": [],
  "deviations": [],
  "worktrees": []
}
