{
  "schema_version": 3,
  "artifact": "change-status",
  "change": "2026-08-23-native-git-revision-comparison",
  "change_status": "completed",
  "current_work": null,
  "created_at": "2026-08-23T23:57:54+08:00",
  "updated_at": "2026-08-24T00:22:54+08:00",
  "completed_at": "2026-08-24T00:22:54+08:00",
  "archived": false,
  "archive_path": null,
  "blockers": [],
  "deviations": [],
  "worktrees": []
}
