{
  "schema_version": 3,
  "artifact": "change-status",
  "change": "2026-08-09-review-all-git-changes",
  "change_status": "active",
  "current_work": "specdev/goal-plan",
  "created_at": "2026-08-09T10:14:40+08:00",
  "updated_at": "2026-08-09T13:02:02+08:00",
  "completed_at": null,
  "archived": false,
  "archive_path": null,
  "blockers": [],
  "deviations": [],
  "worktrees": []
}
