{
  "schema_version": 3,
  "artifact": "change-status",
  "change": "2026-08-24-git-visual-clarity-overhaul",
  "change_status": "completed",
  "current_work": null,
  "created_at": "2026-08-24T12:00:00+08:00",
  "updated_at": "2026-08-24T12:30:00+08:00",
  "completed_at": "2026-08-24T12:30:00+08:00",
  "archived": false,
  "archive_path": null,
  "blockers": [],
  "deviations": [],
  "worktrees": []
}
