{
  "schema_version": 3,
  "artifact": "change-status",
  "change": "2026-08-10-fix-toolbox-command-context-and-blame-layout",
  "change_status": "archived",
  "current_work": null,
  "created_at": "2026-08-10T08:50:28+08:00",
  "updated_at": "2026-08-12T14:48:00+08:00",
  "completed_at": "2026-08-12T14:46:19+08:00",
  "archived": true,
  "archive_path": "<Path>{roots.state}/specdev/archive/2026-08/2026-08-10-fix-toolbox-command-context-and-blame-layout</Path>",
  "blockers": [],
  "deviations": [
    "D-T01-001: 用户禁止创建提交，固定点审查改用 HEAD 工作树 diff 与未跟踪清单。",
    "D-T01-002: 用户批准将已发布 v0.1.3 的 Blame 视觉修复前向递增至 v0.1.4，并更新日期/单附件布局契约。",
    "D-A-2026-08-12: 用户确认全部关闭；接受 AC-004/AC-005 真实主题截图未在当前环境执行的残余风险，不将其记为自动化通过"
  ],
  "worktrees": []
}
